{
  "asset_id": "11111111-1111-4111-8111-111111111111",
  "workspace_id": "22222222-2222-4222-8222-222222222222",
  "content_id": null,
  "filename": "launch.mp4",
  "media_type": "video/mp4",
  "byte_size": 1024,
  "sha256": "aaaaaaaaaaaaaaaaaaaaaaaaaaaaaaaaaaaaaaaaaaaaaaaaaaaaaaaaaaaaaaaa",
  "status": "complete",
  "ownership_confirmed": true,
  "failure_category": null,
  "created_at": "2026-08-21T10:00:00.000Z",
  "updated_at": "2026-08-21T10:00:01.000Z"
}
